Candidate,Price USD,Weight (g),Dimensions (mm),Mount Pattern,Input Voltage (V),Current Max (mA),Power Max (W),Video Input,Input Port Type,Video Pass-Through,Pass-Through Wiring Method,Recording Format,Max Resolution,Frame Rate,Storage Type,Max Storage,Audio Recording,Start/Stop Control,Included Cables,Notes,Sourcing
RunCam Mini FPV DVR (RUNCAM-DVR-S),$17.99,3.5,"25×25×6 (est)",20×20mm M2,3.3-5.5,250,1.3,CVBS analog,Solder pads (1.0mm pitch): 3.3-5.5V IN, GND, V_IN, V_OUT, AUDIO_IN, H/L,Yes (lossless),Direct solder: Camera V_OUT → DVR V_IN / DVR V_OUT → VTX V_IN. No external splitter needed.,MJPEG / AVI,720×480 (D1),30fps,microSD,32GB,Yes (audio+video),Via flight controller GPIO (SpeedyBee App),USB cable (sold separately),Lightest option. Regulated 5V @250mA output for camera. Can bind to ARM mode for auto recording.,shop.runcam.com / Amazon
RunCam Mini FPV DVR (Amazon),$29.99,3.5,"25×25×6 (est)",20×20mm M2,3.3-5.5,250,1.3,CVBS analog,Solder pads (1.0mm pitch): 3.3-5.5V IN, GND, V_IN, V_OUT, AUDIO_IN, H/L,Yes (lossless),Direct solder: Camera V_OUT → DVR V_IN / DVR V_OUT → VTX V_IN. No external splitter needed.,MJPEG / AVI,720×480 (D1),30fps,microSD,32GB,Yes (audio+video),Via flight controller GPIO (SpeedyBee App),USB cable (sold separately),Same product at Amazon markup. Faster shipping option.,Amazon
Eachine EV100 Micro AV Recorder,$16.14,9,38.5×30.8×12.5,N/A (double-sided tape),5 / 7.4 (2S),240,1.2,CVBS analog,"3.5mm TRRS AV jack (combined in/out) + JST-SH 1.0mm (power/control)",Yes,Included A/V cable splits to separate RCA/phono plugs for video in, video out, audio. Internal pass-through circuit.,AVI (MJPEG),1280×480 (HD),30fps,TF/microSD,32GB,Yes (audio+video),Push-button (on module),A/V cable + power cable included,Cheapest option. Good resolution (1280×480). Includes cables. Slightly heavier.,Banggood / AliExpress
Eachine ProDVR,$16.46,9.9,"41×32.9×9",N/A (adhesive included),5,~200,1.0,CVBS analog,"JST-SH 1.0mm 5-pin connector (power, video in, video out, audio) + solder pad backup",Yes,"Included breakout cable has dedicated lines: Video In (yellow), Video Out (yellow/white), Audio (white), Power (red), GND (black). Internal pass-through.",AVI (MJPEG),1280×480 (HD),30fps,TF/microSD,32GB,Yes (audio+video),Push-button (on module),Power/CAM cable + video cable + key wire included,Full analog of HMDVR recorder. Can be used onboard or ground-side. Firmware update available.,AliExpress / Banggood
Generic Mini FPV DVR (Aluminum Case),$14.99,12,"40×30×15 (est)",N/A (adhesive),5-8.4,~250,~1.3,CVBS analog,"Pigtail leads (pre-wired): V_in (yellow), V_out (yellow), GND (black), power (red), audio (white)",Yes (via CVBS output),"Pre-wired pigtails: Camera V_OUT connects to yellow V_IN lead; DVR yellow V_OUT lead goes to VTX. Power (red) to BEC, GND (black) to common ground.",MJPEG / AVI,1280×480 (HD),30fps,TF/microSD,32GB,Yes (audio+video),Push-button,Power + AV cables included,Aluminum alloy CNC case. 4-level battery indicator. Heavier but more rugged.,AliExpress / eBay
Generic Mini FPV DVR (eBay),$11.99,9,"38×30×12 (est)",N/A (adhesive),5,~240,~1.2,CVBS analog,"Pigtail leads (pre-wired): V_in, V_out, GND, power, audio",Yes,"Pre-wired pigtails: Camera V_OUT → DVR V_IN lead; DVR V_OUT lead → VTX. Dedicated power lead to BEC.",MJPEG,1280×480 (HD),30fps,TF/microSD,32GB,Yes,Remote button included,Power + AV cables + button included,Includes 32GB TF card. Cheapest option. Minimal branding.,eBay
Generic Mini FPV DVR (no card),$8.99,8,"38×30×12 (est)",N/A (adhesive),5,~220,~1.1,CVBS analog,"Pigtail leads (pre-wired): V_in, V_out, GND, power, audio",Yes,"Pre-wired pigtails: Camera V_OUT → DVR V_IN lead; DVR V_OUT lead → VTX. Dedicated power lead to BEC.",MJPEG,1280×480 (HD),30fps,TF/microSD,32GB,Yes,Push-button,AV cable included,Lowest cost option. No microSD included. No-name brand. Unknown reliability.,AliExpress